episode,film,character,line
1,The Phantom Menace,JAR JAR,"No… mesa no tink so. Gungan hiden. When in trouble, go"
1,The Phantom Menace,QUI-GON,Do you know where they are?
1,The Phantom Menace,EXT. NABOO SWAMP,– DAY
1,The Phantom Menace,CAPT. PANAKA,"Yes, Your Highness?"
1,The Phantom Menace,JAR JAR,Dissen it.
1,The Phantom Menace,JAR JAR,"makes a strange chattering noise. Suddenly, out of"
1,The Phantom Menace,JAR JAR,"(Cont’d) Heyo-dalee, Captain Tarpals."
1,The Phantom Menace,CAPT. TARPALS,Binks!! Noah gain!
1,The Phantom Menace,JAR JAR,We comen to see da boss.
1,The Phantom Menace,CAPTIAN TARPALS,rolls his eyes.
1,The Phantom Menace,CAPT. TARPALS,"Ouch time, Binks… Ouch time for all-n youse."
1,The Phantom Menace,JAR,"JAR, QUEEN AMIDALA, ANAKIN, ARTOO, QUI-GON, OBI-"
1,The Phantom Menace,BOSS NASS,"Jar Jar, yousa payen dis time. Who’s da uss-en"
1,The Phantom Menace,QUEEN AMIDALA,steps forward. CAPTAIN PANAKA and the JEDI
1,The Phantom Menace,AMIDALA I,am Queen Amidala of the Naboo… I come before you in
1,The Phantom Menace,BOSS NASS,Naboo biggen. Yousa bringen da Mackineeks… Dya
1,The Phantom Menace,CAPTAIN PANAKA,and HALF A DOZEN GUARDS and PILOTS look
1,The Phantom Menace,AMIDALA,We wish to form an alliance…
1,The Phantom Menace,PADME,Your Honor…
1,The Phantom Menace,ARTOO,whistles a quiet “uh oh.”
1,The Phantom Menace,BOSS NASS,Whosa dis?
1,The Phantom Menace,PADME I,am Queen Amidala. (points to Queen) This is my decoy…
1,The Phantom Menace,GUNGAN LOOKOUT,Daza comen!
1,The Phantom Menace,PADME,"(Cont’d) … I am sorry for my deception, but under the"
1,The Phantom Menace,PADME,drops to her knees and prostrates herself before BOSS
1,The Phantom Menace,NASS.,"There is a gasp from CAPTAIN PANAKA, HIS TROOPS, and"
1,The Phantom Menace,PADME,(Cont’d) We are your humble servants… our fate is in your
1,The Phantom Menace,GUNGAN COUNCIL.,"Then the HANDMAIDENS, ANAKIN, and finally"
1,The Phantom Menace,BOSS NASS,Yousa no tinken yousa greater den da Gungans.. Mesa
1,The Phantom Menace,INT. NABOO PALACE,– THRONE ROOM – DAY
1,The Phantom Menace,NUTE,… we’ve sent out patrols. We’ve already located their starship
1,The Phantom Menace,DARTH SIDIOUS,This is an unexpected move for her. It’s too
1,The Phantom Menace,DARTH MAUL,"Yes, my Master."
1,The Phantom Menace,DARTH SIDIOUS,Be patient… Let them make the first move.
1,The Phantom Menace,A GUNGAN SENTRY,"sits on top of the ancient temple head,"
1,The Phantom Menace,QUI-GON,Good.
1,The Phantom Menace,INT. THEED,– CENTRAL HANGER – DAY
1,The Phantom Menace,ANAKIN,All right. They’re here!
1,The Phantom Menace,OOM-9 I,am increasing security at all Naboo detention camps.
1,The Phantom Menace,JAR JAR,"Oh, no, no, no…"
1,The Phantom Menace,BOSS NASS,"So, wesa maken yousa Bombad General."
1,The Phantom Menace,JAR JAR,"General??! Oh, no.."
1,The Phantom Menace,JAR,"JAR’s eyes roll back, his tongue flops out and he faints. FOUR"
1,The Phantom Menace,SPEEDERS,pull up to the GROUP. CAPTAIN PANAKA and a
1,The Phantom Menace,DOZEN OR SO GUARDS,and PILOT pile out and join the group.
1,The Phantom Menace,PADME,What is the situation?
1,The Phantom Menace,CAPT. PANAKA,Almost everyone’s in camps. A few hundred police
1,The Phantom Menace,PADME,The battle is a diversion. The Gungans must draw the Droid
1,The Phantom Menace,QUI-GON,and OBI-WAN look on with interest.
1,The Phantom Menace,PADME,"(Cont’d) What do you think, Master Jedi?"
1,The Phantom Menace,QUI-GON,The Viceroy will be well guarded.
1,The Phantom Menace,CAPT. PANAKA,The difficulty’s getting into the throne room. Once
1,The Phantom Menace,QUI-GON,There is a possibility with this diversion many Gungans will
1,The Phantom Menace,BOSS NASS,Wesa ready to do are-sa part.
1,The Phantom Menace,JAR JAR,smiles a very worried and sheepish grin. ANAKIN watches
1,The Phantom Menace,PADME,We have a plan which should immobilize the Droid Army. We
1,The Phantom Menace,QUI-GON A,"well-conceived plan. However, there’s great risk. The"
1,The Phantom Menace,OBI-WAN,"And there’s an even bigger danger. If the Viceroy escapes,"
1,The Phantom Menace,PADME,That is why we must not fail to get to the Viceroy. Everything
1,The Phantom Menace,INT. THEED,– PALACE – THRONE ROOM – DAY
1,The Phantom Menace,SIDIOUS,walk through the throne room.
1,The Phantom Menace,OBI-WAN,and QUI-GON stand silently for a moment.
1,The Phantom Menace,BOSS NASS,Yousa doen grand. Jar Jar bringen da Naboo together.
1,The Phantom Menace,DARTH SIDIOUS,… she is more foolish than I thought.
1,The Phantom Menace,EIRTAE,stand nearby. BOSS NASS puts his arm around JAR JAR.
1,The Phantom Menace,NUTE,We are sending all available troops to meet this army of hers
1,The Phantom Menace,DARTH SIDIOUS,The Jedi cannot become involved. They can only
1,The Phantom Menace,NUTE I,"have your approval to proceed then, My Lord."
1,The Phantom Menace,DARTH SIDIOUS,Proceed. Wipe them put… all of them.
1,The Phantom Menace,INT. NABOO SWAMP LAKE,– DAY (FX)
1,The Phantom Menace,LITTLE ANIMALS,flee in all directions as the GUNGAN ARMY
1,The Phantom Menace,JAR,is nervous. GENERAL CEEL signals to the shield operators.
1,The Phantom Menace,GENERAL CEEL,Energize the shields.
1,The Phantom Menace,EXT. THEED,– CENTRAL PLAZA – DAY
1,The Phantom Menace,QUI-GON,"Once we get inside, Annie, you find a safe place to hide"
1,The Phantom Menace,ANAKIN,Sure.
1,The Phantom Menace,QUI-GON,And stay there!
1,The Phantom Menace,ANAKIN,"yells and runs over to PADME and the JEDI, who are"
1,The Phantom Menace,DROID TROOPS,mill about the tank-filled plaza. At the far end of the
1,The Phantom Menace,ALARMS ARE SOUNDING,"a PADME, the JEDI, ANAKIN, EIRTAE,"
1,The Phantom Menace,BATTLE,"DROIDS, causing them to EXPLODE."
1,The Phantom Menace,INT. THEED,– PALACE THRONE ROOM – DAY
1,The Phantom Menace,NUTE I,thought the battle was going to take place far from here… this
1,The Phantom Menace,RUNE,What is going on?
1,The Phantom Menace,DARTH MAUL,enters the throne room.
1,The Phantom Menace,DARTH MAUL I,told you there was more to this… the Jedi are
1,The Phantom Menace,EXT. NABOO GRASS PLAINS,– DAY (FX)
1,The Phantom Menace,GUNGANS,"CHEER, until they see the doors to the massive"
1,The Phantom Menace,OOM-9,"gives the command to move forward, and THOUSANDS OF"
1,The Phantom Menace,DARTH MAUL I,"feel there is more to this, My Master. The two Jedi"
1,The Phantom Menace,INT. THEED,– CENTRAL HANGER – DAY
1,The Phantom Menace,ANAKIN,"(subtitled) Cha skrundee da pat, sleemo. (Don’t count on it,"
1,The Phantom Menace,JAR,stops and sniffs the air. The GROUP stop behind him.
1,The Phantom Menace,QUI-GON,"dies. OBI-WAN cradles his Master, quietly weeping."
1,The Phantom Menace,ANAKIN,"(Cont’d) Yeah, all right. “Droid blaster.” Yeah!"
1,The Phantom Menace,EIRTAE,also blast away at the DROIDS. PADME signals to her
1,The Phantom Menace,PADME,Get to your ships!
1,The Phantom Menace,FIGHTER PILOT,"Better find a new hiding place, kid. I’m taking this"
1,The Phantom Menace,EXT. THEED,– CENTRAL PLAZA – DAY (FX)
1,The Phantom Menace,INT. THEED,– CENTRAL HANGER – DAY
1,The Phantom Menace,CAPTAIN,"PANAKA, SABE and NABOO TROOPS rush into the"
1,The Phantom Menace,PADME,My guess is the Viceroy is in the throne room.
1,The Phantom Menace,QUI-GON I,agree.
1,The Phantom Menace,ANAKIN,is hiding. ARTOO whistles a greeting as ANAKIN peeps out
1,The Phantom Menace,ANAKIN,Hey! Wait for me.
1,The Phantom Menace,QUI-GON,"No, Annie, you stay there. Stay right where you are."
1,The Phantom Menace,ANAKIN,"But, I…"
1,The Phantom Menace,QUI-GON,Stay in that cockpit.
1,The Phantom Menace,QUI-GON,(Cont’d) We’ll’ handle this…
1,The Phantom Menace,DARTH MAUL,"takes off his cape, and ignites his laser sword. Both"
1,The Phantom Menace,DROIDS,roll in and transform into their battle position. ARTOO calls
1,The Phantom Menace,ANAKIN,"Oh, no…"
1,The Phantom Menace,ANAKIN,"(Cont’d) We gotta do something, Artoo."
1,The Phantom Menace,ARTOO,"whistles a reply. Suddenly, the ship’s systems go on, and the"
1,The Phantom Menace,ANAKIN,"(Cont’d) All right, thanks Artoo! Great idea! I’ll take over."
1,The Phantom Menace,ANAKIN,"steers the ship toward the DROIDS. He pushes a button,"
1,The Phantom Menace,ANAKIN,"(Cont’d) Where’s the trigger? Oops, wrong one.. Maybe this"
1,The Phantom Menace,DROIDS,"are momentarily distracted by ANAKIN, CAPTAIN PANAKA,"
1,The Phantom Menace,ANAKIN,"pushes a second button, and the lasers begin to fire, wiping"
1,The Phantom Menace,DROIDS,start firing at ANAKIN. There are EXPLOSIONS all around
1,The Phantom Menace,INT. THEED,– POWER GENERATOR PIT – DAY
1,The Phantom Menace,ANAKIN,"flips several switches, and the after-burner ignites."
1,The Phantom Menace,ANAKIN,(Cont’d) I know we’re moving. I’ll shut the energy drive
1,The Phantom Menace,ANAKIN,(Cont’d) Oops!! Wrong one.
1,The Phantom Menace,ARTOO,beeps.
1,The Phantom Menace,ANAKIN,(Cont’d) I’m not doing anything!
1,The Phantom Menace,ARTOO,beeps.
1,The Phantom Menace,ANAKIN,(Cont’d) I know… I didn’t push anything.
1,The Phantom Menace,INT. NABOO STARFIGHTER,– COCKPIT – SPACE
1,The Phantom Menace,RIC OLIE,"Bravo Flight A, take on the fighters. Flight B, make the run"
1,The Phantom Menace,BRAVO TWO,"Roger, Bravo Leader."
1,The Phantom Menace,RIC OLIE,Enemy fighters straight ahead!
1,The Phantom Menace,JAR,JAR’s clumsiness works for him in the battle. He gets caught up
1,The Phantom Menace,GON,and the DARK LORD. When the wall between QUI-GON and
1,The Phantom Menace,DROIDS,in one process. OOM-9 decides to send in the WHEEL
1,The Phantom Menace,DROIDS,and gives the signal. HUNDREDS OF WHEEL DROIDS roll
1,The Phantom Menace,DROIDS,with energy balls. The DESTROYER DROIDS blast many
1,The Phantom Menace,INT. NABOO STARFIGHTER,– COCKPIT – SPACE
1,The Phantom Menace,ANAKIN,The Autopilot is searching for what other ships?
1,The Phantom Menace,ARTOO,beeps and whistles.
1,The Phantom Menace,ANAKIN,"(Cont’d) There is no manual override, Artoo. You’ll have to"
1,The Phantom Menace,ARTOO,chirps that he’s trying.
1,The Phantom Menace,ANAKIN,(cont’d) Look! There they are! That’s where the autopilot is
1,The Phantom Menace,INT. THEED,– CENTRAL HANGER – DAY
1,The Phantom Menace,ANAKIN,(Cont’d) Oops… shield up! Always on the right… shields
1,The Phantom Menace,INT. THEED,– PALACE – HALLWAY – DAY
1,The Phantom Menace,PADME,"We don’t have time for this, Captain."
1,The Phantom Menace,CAPT. PANAKA,Let’s try the outside stairway.
1,The Phantom Menace,SOLDIERS,are lined up along the edge. They have pulled small
1,The Phantom Menace,JAR JAR,tries to run from the BATTLE DROIDS.
1,The Phantom Menace,GENERAL CEEL,Retreat! Retreat!
1,The Phantom Menace,INT. NABOO STARFIGHTER,– COCKPIT -SPACE
1,The Phantom Menace,ANAKIN,finds himself in the middle of the space battle. A ship
1,The Phantom Menace,ANAKIN,"Whoo, boy! This is tense!"
1,The Phantom Menace,ANAKN,"(Cont’d) Oops! Artoo, get us off Autopilot!"
1,The Phantom Menace,ARTOO,screams a reply.
1,The Phantom Menace,ANAKIN,(Cont’d) I’ve got control?
1,The Phantom Menace,ANAKIN,flips switches.
1,The Phantom Menace,ANAKIN,"(Cont’d) Okay, let’s go left!"
1,The Phantom Menace,ANAKIN,"(Cont’d) Yes… I’ve got control. You did it, Artoo!"
1,The Phantom Menace,ARTOO,beeps
1,The Phantom Menace,ANAKIN,(Cont’d) Go back!?! Qui-Gon told me to stay in this cockpit
1,The Phantom Menace,ANAKIN,(Cont’d) Oops! Whoa!
1,The Phantom Menace,ANAKIN,"(Cont’d) I’ll try spinning, that’s a good trick."
1,The Phantom Menace,ANAKIN,rolls the ship as ARTOO screams desperately.
1,The Phantom Menace,ANAKIN,(Cont’d) I know we’re in trouble! Hang on! The way out of
1,The Phantom Menace,ARTOO,beeps a reply.
1,The Phantom Menace,ANAKIN,(Cont’d) Which one? This one?
1,The Phantom Menace,ANAKIN,yanks on the reverse thrusters and the ship slows instantly-
1,The Phantom Menace,ANAKIN,Yes… we have ignition.
1,The Phantom Menace,INT. NABOO STARFIGHTER,– COCKPIT – SPACE
1,The Phantom Menace,EXT. THEED,– PALACE – OVER WATERFALL – DAY
1,The Phantom Menace,CAPTAIN PANAKA,"blasts a hole in the window, and they make their"
1,The Phantom Menace,BRAVO TWO,"Roger, Bravo Leader."
1,The Phantom Menace,ANAKIN I,"know, Artoo! This isn’t Podracing!"
1,The Phantom Menace,RIC OLIE,Their deflector shield is too strong. We’ll never get through
1,The Phantom Menace,ARTOO,screams.
1,The Phantom Menace,ANAKIN,regains control as his ship enters the space station hanger.
1,The Phantom Menace,ANAKIN,(Cont’d) Great gobs of bantha poo-doo!
1,The Phantom Menace,ANAKIN,(Cont’d) I’m trying to stop! I’m trying to stop! Whoa!
1,The Phantom Menace,ANAKIN,hits the reverse thrusters and the ship skids to a stop on the
1,The Phantom Menace,ANAKIN,(Cont’d) All right! All right! Get the system started!
1,The Phantom Menace,ANAKIN,ducks down to adjust a control panel.
1,The Phantom Menace,ANAKIN,(Cont’d) Everything’s overheated. All the lights are red.
1,The Phantom Menace,ARTOO,"sees DROIDS approaching, and beeps frantically."
1,The Phantom Menace,INT. THEED,– POWER GENERATOR PIT – DAY
1,The Phantom Menace,EXT. NABOO GRASS PALINS,– DAY
1,The Phantom Menace,INT. THEED,– POWER GENERATOR ELECRIC BEAM –
1,The Phantom Menace,PADME,Throw down your weapons. They win this round.
1,The Phantom Menace,CAPT. PANAKA,But we can’t…
1,The Phantom Menace,PADME,"Captain, I said throw down your weapons."
1,The Phantom Menace,CAPTAIN PANAKA,and HIS MEN throw down their weapons.
1,The Phantom Menace,EXT. NABOO GRASS PLAINS,– DAY
1,The Phantom Menace,A DESTROYER DROID,"blasts one of the shield generators, causing"
1,The Phantom Menace,OOM-9,sees the shield weaken and orders his tanks forward. The
1,The Phantom Menace,GUNGAN GENERAL,signals a retreat as the tanks enter the battle.
1,The Phantom Menace,KAADU,and lands on one of the tank guns. A GUNGAN WARRIOR
1,The Phantom Menace,GUNGAN WARRIOR. EXPLOSIONS,from the tank fire are
1,The Phantom Menace,INT. THEED,– POWER GENERATOR ELECTRIC BEAM –
1,The Phantom Menace,INT. THEED,– PALACE – HALLWAY TO THRONE ROOM
1,The Phantom Menace,ANAKIN,"hides behind one of the Naboo fighters, ducking as large"
1,The Phantom Menace,RIC OLIE,Bravo flight… go for the central bridge.
1,The Phantom Menace,EXT. NABOO GRASS PLAINS,– DAY
1,The Phantom Menace,JAR JAR,"Dissa bad, berry bombad."
1,The Phantom Menace,GENERAL CEEL,Mesa hopen dissa working for da Queen.
1,The Phantom Menace,INT. THED,– PALACE THRONE ROOM – DAY
1,The Phantom Menace,FOUR NEIMOIDIAN COUNCIL,MEMBERS.
1,The Phantom Menace,NUTE,"Your little insurrection is at an end, Your Highness. Time for"
1,The Phantom Menace,SADBE,dressed like the Queen appears in the doorway with
1,The Phantom Menace,SEVERAL TROOPS.,Several destroyed battle droids can be seen in
1,The Phantom Menace,SABE I,"will not be signing any treaty, Viceroy, because you’ve lost!"
1,The Phantom Menace,NUTE,and THE OTHERS are stunned to see a SECOND QUEEN.
1,The Phantom Menace,NUTE,yells at the TEN GUARDS in the room.
1,The Phantom Menace,NUTE,After her! This one is a decoy!
1,The Phantom Menace,SIX OF THE DROIDS,rush out of the throne room after SABE. NUTE
1,The Phantom Menace,NUTE,(Cont’d) Your Queen will not get away with this.
1,The Phantom Menace,PADME,slumps down on her throne and immediately hits a security
1,The Phantom Menace,PADME,"grabs two pistols, tosses one of the to CAPTAIN PANAKA"
1,The Phantom Menace,PADME,"Now, Viceroy, this is the end of your occupation here."
1,The Phantom Menace,NUTE,Don’t be absurd. There are too few of you. It won’t be long
1,The Phantom Menace,INT. THEED,– POWER GENERATOR – MELTING PIT
1,The Phantom Menace,OBI-WAN,"screams as the pulsing electron gate opens, and the SITH"
1,The Phantom Menace,LORD,attacks him. The DARK LORD is relentless in his assault on
1,The Phantom Menace,WAN,"off guard, and the JEDI slips into a melting pit. He is barely able"
1,The Phantom Menace,OBI-WAN,Master! Master!
1,The Phantom Menace,QUI-GON,It is too late… It’s…
1,The Phantom Menace,OBI-WAN,No!
1,The Phantom Menace,TEY HOW,"Sir, we’re losing power… There is some problem with the"
1,The Phantom Menace,QUI-GON,Obi-Wan promise… promise me you’ll train the boy…
1,The Phantom Menace,QUI-GON,He is the chosen one… he will… bring balance… train him!
1,The Phantom Menace,ANAKIN,peeks over the edge of the cockpit to see BATTLE DROIDS
1,The Phantom Menace,INT. NABOO STARFIGHTER,– COCKPIT – FEDERATION
1,The Phantom Menace,DARTH MAUL,"opens, QUI-GON is in a split second fighting the"
1,The Phantom Menace,ANAKIN,Uh oh. This is not good.
1,The Phantom Menace,ANAKIN,"(Cont’d) The systems are still overheated, Artoo."
1,The Phantom Menace,BATTLE DROID CAPTAIN,Where’s your pilot?
1,The Phantom Menace,ARTOO,beeps a reply.
1,The Phantom Menace,BATTLE DROID CAPTAIN,(Cont’d) You’re the pilot?
1,The Phantom Menace,ARTOO,whistles.
1,The Phantom Menace,BATTLE DROID CAPTAIN,(Cont’d) Let me see your identification!
1,The Phantom Menace,ANAKIN,sees the dashboard lights go from red to green.
1,The Phantom Menace,BATTLE DROID CAPTAIN,(seeing Anakin) You! Come out of there
1,The Phantom Menace,DARK LORD,with a ferocity not seen before. They move into the area
1,The Phantom Menace,ANAKIN,Not if I can help it! Shields up!
1,The Phantom Menace,BATTLE DROID CAPTAIN.,"The OTHER DROIDS shoot, but the"
1,The Phantom Menace,ANAKIN,(Cont’d) This should stop them.
1,The Phantom Menace,ANAKIN,fires lasers as the ship begins to rotate.
1,The Phantom Menace,ANAKIN,(Cont’d) … and take this!
1,The Phantom Menace,ANAKIN,(Cont’d) Darn… I missed!
1,The Phantom Menace,ANAKIN,(Cont’d) Let’s get out of here!
1,The Phantom Menace,ANAKIN,"(Cont’d) Now, this is Podracing! Whoopee!"
1,The Phantom Menace,INT. FEDERATION BATTLESHIP,– BRIDGE
1,The Phantom Menace,TEY HOW,turns to CAPTAIN DOFINE.
1,The Phantom Menace,OBI-WAN,"Yes, Master…"
1,The Phantom Menace,DOFINE,Impossible!! I don’t…
1,The Phantom Menace,ANAKIN,"flips a switch and the ship levitates, knocking over the"
1,The Phantom Menace,PALPATINE,It’s good to be home. Your boldness has saved our
1,The Phantom Menace,BRAVO TWO,What’s that?? It’s blowing up from the inside.
1,The Phantom Menace,RIC OLIE I,"don’t know, we didn’t hit it."
1,The Phantom Menace,BRAVO THREE,Look! One of ours! Outta the main hold!!
1,The Phantom Menace,EXT. NABOO GRASS PLAINS,– DAY
1,The Phantom Menace,FROZEN DROIDS. JAR JAR,"pushes one of the BATTLE DROIDS,"
1,The Phantom Menace,JAR JAR,Wierdind…
1,The Phantom Menace,EXT. THEED,– CENTRAL HANGER – DAY
1,The Phantom Menace,ANAKIN,and ARTOO follow the squad of yellow Naboo starfighters
1,The Phantom Menace,INT. THEED,– CENTRAL HANGER – DAY
1,The Phantom Menace,RIC OLIE,and the OTHER PILOTS gather around as they exit their
1,The Phantom Menace,BRAVO TWO,"He flew into the hold, behind the deflector shield and"
1,The Phantom Menace,BRAVO THREE,Amazing… They don’t teach that in the academy.
1,The Phantom Menace,RIC,"OLIE, BRAVO TWO, the OTHER PILOTS, and GROUND CREW"
1,The Phantom Menace,RIC OLIE,We’re all accounted for. Who flew that ship?
1,The Phantom Menace,ANAKIN,"I’m not going to get into trouble, am I?"
1,The Phantom Menace,ARTOO,beeps. oh. oh.
1,The Phantom Menace,INT. MAIN HANGER,– COURTYARD – DAY
1,The Phantom Menace,TROOPS,"guard NUTE GUNRAY and RUNE HAAKO. OBI-WAN, the"
1,The Phantom Menace,PADME,"Now, Viceroy, you are going to have to go back to the"
1,The Phantom Menace,CAPT. PANAKA I,think you can kiss your Trade franchise goodbye.
1,The Phantom Menace,GUARDS,"descend the walkway, followed by YODA and SEVERAL"
1,The Phantom Menace,INT. NABOO FIGHTER,– COCKPIT – SPACE
1,The Phantom Menace,PANAKA,lead the VICEROY and HIS ASSISTANT toward the ship.
1,The Phantom Menace,OTHER JEDI MASTERS.,The CHANCELLOR PALPATINE is
1,The Phantom Menace,RIC OLIE,watches in amazement as the Federation battleship starts
1,The Phantom Menace,ANAKIN,sheepishly opens the cockpit and stands up. All the PILOTS
1,The Phantom Menace,OBI-WAN,greets YODA and the OTHER JEDI as CAPTAIN PANAKA
1,The Phantom Menace,YODA,"Confer on you, the level of Jedi Knight the Council does. But"
1,The Phantom Menace,OBI-WAN,Qui-Gon believed in him. I believe in Qui-Gon.
1,The Phantom Menace,AMIDALA,"Congratulations on your election, Chancellor. It is so good"
1,The Phantom Menace,YODA,"The Chosen One the boy may be; nevertheless, grave danger"
1,The Phantom Menace,OBI-WAN,"Master Yoda, I gave Qui-Gon my word. I will train Anakin."
1,The Phantom Menace,YODA,"Qui-Gon’s defiance I sense in you. Need that, you do not."
1,The Phantom Menace,EXT. THEED,– CENTRAL PLAZA – FUNERAL TEMPLE STEPS –
1,The Phantom Menace,ABOUT ONE HUNDRED NABOO,"TROOPES, TWENTY OTHER"
1,The Phantom Menace,BOSS,"NASS, and TWENTY OTHER GUNGAN WARRIORS watch."
1,The Phantom Menace,OBI-WAN,"He is one with the Force, Anakin… You must let go."
1,The Phantom Menace,ANAKIN,What will happen to me now?
1,The Phantom Menace,OBI-WAN I,"am your Master now. You will become a Jedi, I promise."
1,The Phantom Menace,INT. TURRET ROOM,– NABOO PALACE – LATE DAY
1,The Phantom Menace,MACE WINDU,There is no doubt. The mysterious warrior was a Sith.
1,The Phantom Menace,JAR JAR,and GENERAL CEEL. The GUNGANS ride KAADU. They
1,The Phantom Menace,COUNCIL. ARTOO,stands in front of the QUEEN’S HANDMAIDENS
1,The Phantom Menace,SOLDIERS.,The CROWDS CHEER. It is a grand parade. QUEEN
1,The Phantom Menace,CHILDEREN SING,and throw flowers on the passing GUNGAN
1,The Phantom Menace,AMIDALA,stands next to the SUPREME CHANCELLOR
1,The Phantom Menace,EXT. THEED,– CENTRAL PLAZA – DAY
1,The Phantom Menace,MACE WINDU,"But which one was destroyed, the master or the"
1,The Phantom Menace,YODA,Always two there are… no more… no less. A master and an
1,The Phantom Menace,IRIS,OUT
1,The Phantom Menace,BOSS NASS,holds up the Globe of Peace. EVERYONE CHEERS.
2,Attack of the Clones,CHANCELLOR PALPATINE,sits behind his desk with TWO RED-
2,Attack of the Clones,PALPATINE,"confers with an AIDE, UV GIZEN, riding a small one"
2,Attack of the Clones,PAN UP,to reveal the amber city planet of Coruscant. A yellow Naboo
2,Attack of the Clones,CAPTAIN,TYPHO
2,Attack of the Clones,FLASH,and a huge EXPLOSION. The DIGNITARIES and PILOTS
2,Attack of the Clones,ESCORT PILOTS,get up and run to where SENATOR AMIDALA lies
2,Attack of the Clones,SENATOR,PADMÉ AMIDALA.
2,Attack of the Clones,AMBASSADOR OF GLEE,ANSELM.
2,Attack of the Clones,OBI-WAN,"and becomes extremely excited, jumping around, shaking"
2,Attack of the Clones,CHANCELLOR PALPATINE,steps to the podium.
2,Attack of the Clones,AMIDALA,looks angry and frustrated. PALPATINE gives her a
2,Attack of the Clones,SENATOR ORN FREE TAA,swings forward in his pod.
2,Attack of the Clones,ORN FREE,TAA
2,Attack of the Clones,JAR,"and DORMÉ, maneuvers her pod into the center of the vast"
2,Attack of the Clones,JANGO,FETT
2,Attack of the Clones,ORN MEE,TAA
2,Attack of the Clones,MAS,AMEDDA
2,Attack of the Clones,FREE TAA,moves his pod next to AMIDWA.
2,Attack of the Clones,PALPATINE,"nods to MACE WINDU, who nods back."
2,Attack of the Clones,ADI,"MUNDI,"
2,Attack of the Clones,MAS,"AMEDDA, DORMÉ, and THREE SENATORS (BAIL ORGANA,"
2,Attack of the Clones,LUMINARA,"UNDULI, and HOROX RYYDER) enter the office. As"
2,Attack of the Clones,ASK,AAK
2,Attack of the Clones,DAR,WAC
2,Attack of the Clones,YODA,"and MACE WINDU move to greet the SENATOR, YODA taps"
2,Attack of the Clones,AMIDALA,with his cane.
2,Attack of the Clones,MACE,WINDU
2,Attack of the Clones,MACE,WINDU
2,Attack of the Clones,PALPATINE,"gets up, walks to the window, and looks out at the vast"
2,Attack of the Clones,BAIL,ORGANA
2,Attack of the Clones,MACE,WINDU
2,Attack of the Clones,AMIDALA,sighs as the JEDI get up to leave.
2,Attack of the Clones,MACE,WINDU
2,Attack of the Clones,YODA,leans into her ear.
2,Attack of the Clones,EVENING,9
2,Attack of the Clones,MACE,WINDU
2,Attack of the Clones,MACE,WINDU
2,Attack of the Clones,CLAD ROYAL GUARDS,"on either side of the door. YODA, PLO KI-"
2,Attack of the Clones,OBI-WAN,"leans out of the speeder, then crawls out on the front"
2,Attack of the Clones,JAR JAR,notices OBI-WAN’S APPRENTICE.
2,Attack of the Clones,JAR,JAR
2,Attack of the Clones,JAR,JAR
2,Attack of the Clones,JAR JAR,grabs hold of ANAKIN and envelops him in a big hug.
2,Attack of the Clones,JAR,JAR
2,Attack of the Clones,JAR,"enters the room, followed by the TWO JEDI."
2,Attack of the Clones,JAR,JAR
2,Attack of the Clones,SENATOR. OBI-WAN,steps forward. ANAKIN stares at PADMÉ. She
2,Attack of the Clones,OBI-WAN,looks disapprovingly at his apprentice. PADMÉ laughs and
2,Attack of the Clones,OBI-WAN,smiles.
2,Attack of the Clones,ANAKIN,is standing in the living room. He is in a meditative state. It is
2,Attack of the Clones,CAPTAIN TYPHO,smile.
2,Attack of the Clones,JAR,JAR
2,Attack of the Clones,MACE WINDU,"and YODA walk down the long hallway, silhouetted by"
2,Attack of the Clones,MACE,WINDU
2,Attack of the Clones,MACE,WINDU
2,Attack of the Clones,MACE,WINDU
2,Attack of the Clones,MACE,WINDU
2,Attack of the Clones,MACE,WINDU
2,Attack of the Clones,ROOM,– NIGHT 14
2,Attack of the Clones,CAPTAIN TYPHO,leaves.
2,Attack of the Clones,JAR,JAR
2,Attack of the Clones,OBI-WAN,checks a palm-sized view scanner he has pulled out of his
